{"$schema":"https://json-schema.org/draft/2020-12/schema","title":"Homelab osquery audit snapshot","type":"object","required":["schema_version","audit_timestamp","host_alias","host_role","collector","git_commit_sha","category","observed_facts","collection_status","errors","source"],"properties":{"schema_version":{"const":"1.0"},"audit_timestamp":{"type":"string","format":"date-time"},"host_alias":{"type":"string","minLength":1},"host_role":{"type":"string","minLength":1},"collector":{"type":"object","required":["name","version"],"properties":{"name":{"const":"osqueryi"},"version":{"type":"string"}},"additionalProperties":false},"git_commit_sha":{"type":"string"},"category":{"type":"string"},"observed_facts":{"type":"array","items":{"type":"object","additionalProperties":{"type":["string","number","integer","boolean","null"]}}},"collection_status":{"enum":["OK","UNVERIFIED"]},"errors":{"type":"array","items":{"type":"string"}},"source":{"type":"object","required":["query_pack","query_id"],"properties":{"query_pack":{"type":"string"},"query_id":{"type":"string"}},"additionalProperties":false}},"additionalProperties":false}
